{
  "_readme": "DeepSeek Harness owns these Web Remote event and tool values. The Worker preserves native Session events. The browser reads those same events. LeapMux owns the plan selector values because the native plan state is a boolean. LeapMux image receipts preserve native image identity and order without storing complete text or subprocess output. The Worker adds the native context window to the supplement of each assistant block, because the native usage states no window. notificationEvents lists the Session events that the Worker persists as notifications. A compaction start is live session state, not a row. hookDecisions lists the native decisions that prevent continued work. Both sides read these decisions to identify a hook failure.",
  "events": {
    "AssistantMessage": "assistant/message",
    "UserMessage": "user/message",
    "ToolCall": "tool/call",
    "ToolResult": "tool/result",
    "TurnStart": "turn/start",
    "TurnEnd": "turn/end",
    "AssistantAttempt": "assistant/attempt",
    "RequestContext": "request/context",
    "CompactionEnd": "compaction/end",
    "TodoWrite": "todo/write",
    "WorkflowStart": "tool-workflow/run-start",
    "WorkflowEnd": "tool-workflow/run-end",
    "GoalChange": "goal/change",
    "PlanMode": "plan/mode",
    "SubagentCatalog": "subagent/catalog",
    "WorkflowAgentStart": "tool-workflow/agent-start",
    "WorkflowAgentEnd": "tool-workflow/agent-end",
    "LlmRetry": "llm/retry",
    "LlmRetryStarted": "llm/retry-started",
    "CompactionStart": "compaction/start",
    "HookResult": "hook/result",
    "DeliverablesPresented": "deliverables/presented"
  },
  "tools": {
    "Bash": "bash",
    "Read": "read",
    "ReadImage": "read_image",
    "Write": "write",
    "Edit": "edit",
    "AskUserQuestion": "ask_user_question",
    "ExitPlanMode": "exit_plan_mode",
    "TodoWrite": "todo_write",
    "Subagent": "subagent",
    "SubagentFork": "subagent_fork",
    "SendMessage": "send_message",
    "ListAgents": "list_agents",
    "Workflow": "workflow",
    "RunCode": "run_code",
    "InterruptAgent": "interrupt_agent"
  },
  "modes": {
    "Act": "act",
    "Plan": "plan"
  },
  "permissionPresets": {
    "ReadOnly": "read-only",
    "WorkspaceWrite": "workspace-write",
    "DangerFullAccess": "danger-full-access"
  },
  "options": {
    "Permissions": "permissions",
    "ChildMode": "child-mode"
  },
  "controlEvents": {
    "Approval": "approval/request",
    "UserQuestions": "user-questions/request"
  },
  "contentTypes": {
    "Text": "text",
    "Reasoning": "reasoning",
    "Image": "image",
    "ToolCall": "tool-call"
  },
  "supplement": {
    "BlockIndex": "blockIndex",
    "ContextWindow": "contextWindow",
    "ImageAttachments": "imageAttachments"
  },
  "fields": {
    "Type": "type",
    "Data": "data",
    "Message": "message",
    "Content": "content"
  },
  "_unread": {
    "options": {
      "ChildMode": {
        "sides": [
          "ts"
        ],
        "why": "The Worker reads stored native child modes. The browser reads the derived AgentInfo capability fields instead."
      }
    },
    "events": {
      "LlmRetryStarted": {
        "sides": [
          "ts"
        ],
        "why": "The Worker consumes retry-started and stores no row for the browser."
      },
      "TurnStart": {
        "sides": [
          "ts"
        ],
        "why": "The Worker consumes this event and stores no transcript row."
      },
      "AssistantAttempt": {
        "sides": [
          "ts"
        ],
        "why": "The Worker consumes this event and stores no transcript row."
      },
      "RequestContext": {
        "sides": [
          "ts"
        ],
        "why": "The Worker consumes this event and stores no transcript row."
      },
      "WorkflowStart": {
        "sides": [
          "ts"
        ],
        "why": "The Worker consumes this event and stores no transcript row."
      },
      "WorkflowEnd": {
        "sides": [
          "ts"
        ],
        "why": "The Worker consumes this event and stores no transcript row."
      },
      "WorkflowAgentStart": {
        "sides": [
          "ts"
        ],
        "why": "The Worker consumes this event and stores no transcript row."
      },
      "WorkflowAgentEnd": {
        "sides": [
          "ts"
        ],
        "why": "The Worker consumes this event and stores no transcript row."
      },
      "GoalChange": {
        "sides": [
          "ts"
        ],
        "why": "The Worker consumes this event and stores no transcript row."
      },
      "PlanMode": {
        "sides": [
          "ts"
        ],
        "why": "The Worker consumes this event and stores no transcript row."
      },
      "SubagentCatalog": {
        "sides": [
          "ts"
        ],
        "why": "The Worker consumes this event and stores no transcript row."
      }
    }
  },
  "imageReceiptFields": {
    "SessionID": "sessionId",
    "CallID": "callId",
    "ToolCallID": "toolCallId",
    "ToolName": "toolName",
    "IsError": "isError",
    "OriginalImages": "originalImages",
    "RetainedImages": "retainedImages",
    "Images": "images"
  },
  "imagePositionFields": {
    "Position": "position",
    "Attachment": "attachment"
  },
  "imageReferenceFields": {
    "AttachmentID": "attachmentId",
    "MediaType": "mediaType",
    "Bytes": "bytes",
    "Width": "width",
    "Height": "height"
  },
  "imageValueFields": {
    "Attachment": "attachment",
    "Data": "data"
  },
  "notificationEvents": [
    "CompactionEnd",
    "LlmRetry",
    "HookResult",
    "DeliverablesPresented"
  ],
  "hookDecisions": {
    "Block": "block",
    "Deny": "deny",
    "Stop": "stop"
  }
}
